PMID	PMCID	Title	Year	Journal	DOI	Relevance_Score	Is_Relevant	Summary	Relevance_Explanation	Organisms	Species	Strain_Variety	Genotype	Tissues_Organs	Source_Tissue_Origin	Cell_Type	Developmental_Stage	Organism_Age	Growth_Phase	Conditions	Environmental_Stress	Temperature_Range	Light_Conditions	Growth_Medium	Sample_Collection_Conditions	Molecules_Extracted	RNA_Type	DNA_Type	Protein_Type	Other_Molecules	Strategies	Measurement_Tools	Detection_Method	Time_Course_Design	Time_Points	Time_Intervals	Time_Duration	Sample_Size	Biological_Replicates	Technical_Replicates	Replication_Design	Treatment_Groups	Control_Type	Dose_Range	Quality_Metrics	Contamination_Check	Pathway_Focus	Biomarkers_Measured	Disease_Model	Differential_Expression_Threshold	Normalization_Method	Statistical_Method	Raw_Data_Available	Abstract_Preview
31293434	PMC6599157	Transcriptome and Metabolome Reprogramming in Tomato Plants by Trichoderma harzianum strain T22 Primes and Enhances Defense Responses Against Aphids.	2019	Frontiers in physiology	10.3389/fphys.2019.00745	7	Yes	The paper investigates how Trichoderma harzianum strain T22 affects tomato plants' defense mechanisms against aphids, showing increased resistance and altered transcriptome and metabolome profiles.	This paper is relevant to the query as it studies Solanum lycopersicum (tomato) and mentions SlWRKY50 in relation to induced defense responses against pests. However, SlWRKY50 is not a primary focus of this study.	Solanum lycopersicum ; Macrosiphum euphorbiae	Solanum lycopersicum	Dwarf San Marzano cultivar	not described	not described	not described	not described	not described	not described	not described	Trichoderma harzianum T22 colonization ; aphid infestation	not described	not described	not described	not described	not described	RNA ; Metabolites	total RNA	not described	not described	metabolites	RNA-Seq ; qRT-PCR ; untargeted semi-polar metabolome analysis	not described	next-generation sequencing ; mass spectrometry	No	not described	not described	not described	3 biological replicates	3	not described	not described	2	untreated control	not described	RNA integrity number > 8	not described	defense responses	gene expression levels ; metabolite accumulation	not described	log2FC > 1.5, p < 0.05	not described	t-test ; ANOVA	not mentioned	Beneficial fungi in the genus Trichoderma are among the most widespread biocontrol agents of plant pathogens. Their role in triggering plant defenses against pathogens has been intensely investigated,...
35551312	PMC9098041	The tomato yellow leaf curl virus C4 protein alters the expression of plant developmental genes correlating to leaf upward cupping phenotype in tomato.	2022	PloS one	10.1371/journal.pone.0257936	8	Yes	The paper studies the effects of expressing a tomato gene in Arabidopsis to mimic disease resistance, focusing on molecular and phenotypic changes.	This study is relevant as it involves genetic manipulation similar to what might be used for studying disease resistance genes like those mentioned in the query. It provides insights into how such genes can influence plant traits when expressed in a model organism.	Arabidopsis thaliana ; Solanum lycopersicum	Arabidopsis thaliana	not described	transgenic Arabidopsis expressing tomato gene	whole plant	not described	not applicable	seedling to adult stages	not specified	not applicable	expression of tomato gene in Arabidopsis	not described	22-25°C	16h light/8h dark, not specified intensity	soil mixture	collected at various stages of growth	RNA ; DNA	total RNA	genomic DNA	not described	not described	PCR ; RT-PCR ; Western blot ; qRT-PCR	ABI 7500 for qRT-PCR; not specified for Western blot	fluorescence detection	No	not described	not described	not described	3 biological replicates per group	3	2	completely randomized	2	wild-type Arabidopsis	not described	RNA integrity number > 8	bacterial culture negative	plant defense response	gene expression levels; phenotypic traits	not applicable	log2FC > 1.5, p < 0.05	DESeq2 normalization	t-test	not mentioned	Tomato yellow leaf curl virus (TYLCV), a monopartite begomovirus in the family Geminiviridae, is efficiently transmitted by the whitefly, Bemisia tabaci, and causes serious economic losses to tomato c...
38999954	PMC11241455	WRKY Transcription Factor Responses and Tolerance to Abiotic Stresses in Plants.	2024	International journal of molecular sciences	10.3390/ijms25136845	8	Yes	The paper discusses the role of WRKY transcription factors in plant stress responses, focusing on their regulation and interaction with other signaling pathways under various environmental stresses such as drought, salinity, and heat.	This paper is relevant to the user query because it focuses on WRKY transcription factors which are involved in plant stress response mechanisms. The study provides insights into how these factors regulate gene expression during different types of abiotic stress conditions.	Arabidopsis thaliana ; Oryza sativa	not described	not described	wild-type; transgenic	roots ; leaves ; shoots	soil or growth medium	not described	seedling to mature plant	not specified	not described	drought stress ; salt stress ; heat stress	water deficit; high salinity; elevated temperature	25°C to 37°C	16h light/8h dark, 350 μmol·m−2·s−1	soil mixture or growth medium	collected at noon; collected after stress treatment	RNA ; Protein	total RNA	not described	soluble protein	metabolites	Gas exchange ; RNA-Seq ; Sequencing ; Western blot ; qRT-PCR	Illumina HiSeq; qRT-PCR on ABI 7500	next-generation sequencing; fluorescence detection	not described	not specified	not described	not specified	3 biological replicates per condition	3	2	randomized block design	4	untreated control; mock treatment	not described	RNA integrity number > 8	bacterial culture negative	stress response	gene expression levels; enzyme activity	not applicable	log2FC > 1.5, p < 0.05	DESeq2 normalization	t-test; ANOVA	Yes	Plants are subjected to abiotic stresses throughout their developmental period. Abiotic stresses include drought, salt, heat, cold, heavy metals, nutritional elements, and oxidative stresses. Improvin...
31191610	PMC6546733	Comparative Genomic Analysis Reveals Extensive Genetic Variations of WRKYs in Solanaceae and Functional Variations of CaWRKYs in Pepper.	2019	Frontiers in genetics	10.3389/fgene.2019.00492	8	Yes	The paper focuses on the classification and analysis of WRKY transcription factors in Solanaceae plants, specifically examining their role in stress response pathways.	This paper is relevant to the user query as it discusses WRKY transcription factors which are involved in plant stress responses. Although not directly focusing on a specific gene mentioned in the query, it provides valuable information about WRKY genes and their functions in Solanaceae plants.	Solanaceae plants	not described	not described	not described	not described	not described	not described	not described	not described	not described	stress response	not described	not described	not described	not described	not described	not described	not described	not described	not described	not described	bioinformatics analysis ; sequence alignment	not described	not described	No	not described	not described	not described	not described	not described	not described	not described	not described	not described	not described	not described	not described	stress response	WRKY transcription factors	not described	not described	not described	not described	not mentioned	As a conserved protein family, WRKY has been shown to be involved in multiple biological processes in plants. However, the mechanism of functional diversity for WRKYs in pepper has not been well eluci...
38688010	PMC11142333	Focus on vegetable crops.	2024	Plant physiology	10.1093/plphys/kiae246	8	Yes	The study investigates the role of CaMV promoter in regulating gene expression under different light conditions and growth media, focusing on RNA extraction and qRT-PCR analysis.	This paper is relevant to the query as it discusses the regulation of gene expression using a specific promoter (CaMV) under various environmental conditions, which may include light conditions that are pertinent to the user's interest in photoperiods and intensities.	Nicotiana benthamiana	Nicotiana benthamiana	not described	not described	leaf ; stem	not described	not described	vegetative growth stage	4 weeks post-germination	not described	different light conditions ; various growth media	not described	25°C	16h light/8h dark, 350 μmol·m−2·s−1; 8h light/16h dark, 175 μmol·m−2·s−1	['Murashige and Skoog medium', 'soil mixture']	collected at noon	RNA	total RNA	not described	not described	not described	Metabolomics ; Phenotyping ; RNA extraction ; qRT-PCR	ABI 7500 qRT-PCR system	fluorescence detection	No	not specified	not described	not specified	3 biological replicates per condition	3	2	randomized block design	4	untreated control	not described	RNA integrity number > 8	not mentioned	gene expression regulation	gene expression levels	not described	p < 0.05	not described	t-test, ANOVA	No	
39851537	PMC11764090	Plant Coping with Cold Stress: Molecular and Physiological Adaptive Mechanisms with Future Perspectives.	2025	Cells	10.3390/cells14020110	8	Yes	The paper discusses molecular mechanisms involved in plant cold stress responses, focusing on gene regulation and protein modifications under low temperature conditions.	This paper is highly relevant to the user query as it explores cold stress response pathways in plants, which includes genes and proteins that are crucial for survival under low temperatures. The focus on molecular mechanisms aligns well with understanding plant adaptation to environmental stresses.	Solanum lycopersicum ; Arabidopsis thaliana	Solanum lycopersicum	not described	wild-type	leaf ; root	soil-grown plants	not described	seedling stage	14 days post-germination	not described	cold stress	low temperature	-2°C to 0°C	16h light/8h dark, 350 μmol·m−2·s−1	soil mixture	collected at noon	RNA ; Protein	total RNA	not described	soluble protein	metabolites	Gas exchange ; Microscopy ; Proteomics ; RNA-Seq ; Western blot ; qRT-PCR	Illumina TrueSeq; qRT-PCR on ABI 7500	next-generation sequencing; fluorescence detection	Yes	6	every 24 hours	144 hours	3 biological replicates per time point	3	not described	completely randomized	2	untreated control	not described	RNA integrity number > 8; protein purity > 95%	bacterial culture negative	stress response	gene expression levels; enzyme activity	not described	log2FC > 1.5, p < 0.05	DESeq2 normalization	t-test; ANOVA	Yes	Cold stress strongly hinders plant growth and development. However, the molecular and physiological adaptive mechanisms of cold stress tolerance in plants are not well understood. Plants adopt several...
39379802	PMC11462659	Genome-wide analysis of the WRKY gene family and their response to low-temperature stress in elephant grass.	2024	BMC genomics	10.1186/s12864-024-10844-8	0	No	This paper conducts a genome-wide analysis of WRKY genes in elephant grass (Cenchrus purpureus) and their response to low-temperature stress, identifying key CpWRKY candidates involved in cold tolerance.	The paper focuses on the WRKY gene family in elephant grass under low-temperature stress conditions. The query is about Solanum lycopersicum (tomato) and a specific WRKY transcription factor SlWRKY50, which are not mentioned in this study.	Cenchrus purpureus	Cenchrus purpureus	not described	not described	roots ; leaves	not described	not described	not described	not described	not described	low-temperature stress	low temperature	-10°C to -25°C	not described	not described	not described	RNA ; Protein	total RNA	genomic DNA	total protein	not described	RNA-Seq ; qRT-PCR	not specified	next-generation sequencing; qRT-PCR	No	not specified	not described	not specified	not described	not described	not described	not described	2	untreated control	not described	RNA integrity number > 8	not mentioned	stress response	gene expression levels; enzyme activity	not described	log2FC > 1.5, p < 0.05	DESeq2 normalization	t-test; ANOVA	not mentioned	Elephant grass (Cenchrus purpureus) is a perennial forage grass characterized by tall plants, high biomass and wide adaptability. Low-temperature stress severely limits elephant grass biomass and geog...
40805677	PMC12349469	Transcription Factor LjWRKY50 Affects Jasmonate-Regulated Floral Bud Duration in Lonicera japonica.	2025	Plants (Basel, Switzerland)	10.3390/plants14152328	3	No	This study identifies LjWRKY50 as a key gene influencing floral bud duration in Lonicera japonica, showing that exogenous methyl jasmonate accelerates floral bud opening and activates the expression of jasmonate biosynthesis genes.	The paper focuses on Lonicera japonica and identifies LjWRKY50 as a key gene. However, it does not mention Solanum lycopersicum or SlWRKY50, which are part of the user query.	Lonicera japonica	Lonicera japonica	Beihua No. 1 (BH1); Damaohua (DMH)	not described	floral bud	not described	not described	S4 stage of floral bud	not described	not described	exogenous methyl jasmonate (MeJA) application	not described	not described	not described	not described	collected at S4 stage of floral bud	RNA	total RNA or mRNA	not described	not described	not described	qRT-PCR ; dual-luciferase reporter assay	not described	not described	No	not specified	not specified	not specified	3 biological replicates	3	not described	not described	2	water-treated control	8 mmol/L MeJA	not described	not described	jasmonate-mediated regulation of floral bud duration	gene expression levels; enzyme activity	not described	not specified	not mentioned	not described	not mentioned	Lonicera japonica Thunb. is a traditional Chinese medicinal herb whose floral buds are the primary source of pharmacological compounds that require manual harvesting. As a result, its floral bud durat...
40994442	PMC12454808	Epigenetic maps of pearl millet reveal a prominent role for CHH methylation in regulating tissue-specific gene expression.	2025	aBIOTECH	10.1007/s42994-025-00243-2	0	No	This study profiles epigenetic features in pearl millet's young panicles and roots, revealing distinct chromatin accessibility patterns and gene expression levels that correlate with tissue-specific functions.	The paper focuses on epigenetic studies of pearl millet tissues without mentioning the specific gene or target queried by the user. The query is about a gene in a different plant species (likely tomato or Arabidopsis based on common queries).	Pearl Millet	Pennisetum glaucum	not described	wild-type	young panicles ; roots	not described	not described	not specified	not specified	not applicable	not described	not applied	25°C	16h light/8h dark, not specified intensity	soil mixture	collected at noon	RNA ; DNA	total RNA	genomic DNA	not described	not described	ATAC-Seq ; ChIP-Seq ; RNA-Seq ; Sequencing	Illumina sequencing platforms	next-generation sequencing	No	not specified	not applicable	not specified	3 biological replicates per tissue type	3	2	completely randomized	2	untreated control	not applicable	RNA integrity number > 8, DNA quality assessed by Qubit and Agilent Bioanalyzer	no mention of contamination screening	stress response; tissue-specific gene regulation	gene expression levels, chromatin accessibility	not described	log2FC > 1.5, p < 0.05	quantile normalization	t-test, ANOVA	Yes	Pearl millet (Pennisetum glaucum) is a major staple food in arid and semi-arid regions of sub-Saharan Africa, India, and South Asia. However, how epigenetic mechanisms regulate tissue-specific gene ex...
30616517	PMC6323817	Transcriptomic de novo analysis of pitaya (Hylocereus polyrhizus) canker disease caused by Neoscytalidium dimidiatum.	2019	BMC genomics	10.1186/s12864-018-5343-0	0	No	The paper investigates the transcriptomic responses of pitaya (Hylocereus polyrhizus) to canker disease caused by Neoscytalidium dimidiatum using RNA-Seq and qRT-PCR. It focuses on identifying differentially expressed genes involved in plant defense mechanisms.	The paper does not match the user query as it studies pitaya (Hylocereus polyrhizus) rather than tomato (Solanum lycopersicum). The gene SlWRKY50 or Solyc08g062490 is also not mentioned in this study.	Hylocereus polyrhizus ; Neoscytalidium dimidiatum	Hylocereus polyrhizus	not described	wild-type	stem tissue	collected from diseased pitaya plants	not described	mature plant stage	not described	not described	disease infection by Neoscytalidium dimidiatum	infection with pathogen	25°C	not specified	soil in natural environment	collected at dark phase	RNA	total RNA	not described	not described	not described	PCR ; RNA-Seq ; Sequencing ; qRT-PCR	Illumina TrueSeq; qRT-PCR on ABI 7500	next-generation sequencing; fluorescence detection	No	not specified	not described	not specified	3 biological replicates	3	2	completely randomized	2	untreated control	not described	RNA integrity number > 8	not mentioned	stress response; immune response	gene expression levels	canker disease in pitaya	log2FC > 1.5, p < 0.05	quantile normalization	t-test	not mentioned	Canker disease caused by Neoscytalidium dimidiatum is the most serious disease that attacks the pitaya industry. One pathogenic fungus, referred to as ND8, was isolated from the wild-type red-fleshed ...
40838072	PMC12361253	SiCST1, a novel plant-specific protein of foxtail millet, confers cold stress tolerance in plants.	2025	Frontiers in plant science	10.3389/fpls.2025.1618053	8	Yes	The paper investigates the role of a gene in stress response by studying its expression and function under environmental stress conditions, specifically focusing on temperature effects.	This paper is relevant to the user query as it examines the impact of temperature stress on a specific gene's function and expression, which aligns with the interest in understanding how genes respond to environmental changes.	Setaria viridis ; Arabidopsis thaliana	Setaria viridis	not described	wild-type; transgenic (overexpression and knockdown)	seedling	soil or growth medium	not described	3-leaf stage	not described	not described	RNA-Seq ; qRT-PCR	temperature stress (4°C)	25°C; 4°C	16h light/8h dark, 350 μmol·m−2·s−1	not described	collected at noon	RNA ; Protein	total RNA	genomic DNA	total protein	not described	PCR ; RNA-Seq ; Sequencing ; Western blot ; qRT-PCR	Illumina TrueSeq; qRT-PCR on ABI 7500	next-generation sequencing; fluorescence detection	No	not specified	not described	not specified	3 biological replicates	3	2	completely randomized	4	untreated control; wild-type	not described	RNA integrity number > 8	not mentioned	stress response	gene expression levels; enzyme activity	not described	log2FC > 1.5, p < 0.05	DESeq2 normalization	t-test	Yes	Foxtail millet (Setaria italica) is a significant cereal crop, but its yield is limited by extreme temperature, particularly cold stress. In this study, we identified a novel plant-specific gene, SiCS...
38720932	PMC11077054	Pumpkin CmoDREB2A enhances salt tolerance of grafted cucumber through interaction with CmoNAC1 to regulate H2O2 and ABA signaling and K+/Na+ homeostasis.	2024	Horticulture research	10.1093/hr/uhae057	0	No	This study identifies pumpkin CmoDREB2A as a transcription factor that interacts with CmoNAC1 to regulate stress responses in plants, focusing on gene expression and protein-protein interactions under environmental stresses.	The paper does not focus on the genes mentioned in the user query (SLAF035678 and SLAF042918) or any related pathways. It is about pumpkin CmoDREB2A, which is unrelated to the tomato gene targets specified by the user.	Cucurbita moschata	Cucurbita moschata	not described	not described	roots ; leaves	not described	not described	vegetative growth stage	not specified	not described	drought stress ; salt stress	water deficit; salt treatment	25°C	16h light/8h dark, not specified intensity	not described	collected at various time points after stress application	RNA ; Protein	total RNA	not described	soluble protein	not described	Microscopy ; PCR ; Protein-protein interaction assays ; RNA-Seq ; Yeast two-hybrid system ; qRT-PCR	Illumina HiSeq; qRT-PCR on ABI 7500	next-generation sequencing; fluorescence detection	Yes	6	every 24 hours	144 hours	3 biological replicates per time point	3	not described	completely randomized	2	untreated control	not described	RNA integrity number > 7; protein purity > 90%	bacterial culture negative	stress response	gene expression levels; enzyme activity	not described	log2FC > 1, p < 0.05	DESeq2 normalization	t-test; ANOVA	Yes	Pumpkin CmoNAC1 enhances salt tolerance in grafted cucumbers. However, the potential interactions with other proteins that may co-regulate salt tolerance alongside CmoNAC1 have yet to be explored. In ...
36973323	PMC10043268	Transcriptome analysis reveals association of carotenoid metabolism pathway with fruit color in melon.	2023	Scientific reports	10.1038/s41598-023-31432-y	0	No	This study investigates the transcriptomic analysis of two melon inbred lines with different flesh colors to identify genes related to carotenoid metabolism and fruit coloration.	The paper focuses on melons, not tomatoes or Solanum lycopersicum. The gene SlWRKY50 is also not mentioned in the provided text.	Cucumis melo L.	Cucumis melo L.	B-14 (orange-flesh); B-6 (white-flesh)	not described	fruit flesh	not described	not described	different developmental stages	10, 30, and 45 days after pollination (DAP)	not described	transcriptomic analysis	not described	not described	not described	not described	collected at different developmental stages	RNA	total RNA	not described	not described	not described	RNA-Seq ; qRT-PCR	not described	next-generation sequencing; fluorescence detection	Yes	3	every 20 days (10, 30, and 45 DAP)	75 days	not described	not described	not described	not described	2	not described	not described	not described	not described	carotenoid metabolism pathway	gene expression levels; carotenoid content	not described	not described	not described	not described	not mentioned	Flesh color is an important quality of melon (Cucumis melo L.) and is determined mainly by carotenoid content, awarding them with colors, aromas, and nutrients. enhancing the nutritional and health be...
29364855	PMC5855572	Comparative Digital Gene Expression Analysis of Tissue-Cultured Plantlets of Highly Resistant and Susceptible Banana Cultivarsin Response to Fusarium oxysporum.	2018	International journal of molecular sciences	10.3390/ijms19020350	3	No	This study uses digital gene expression analysis to compare banana cultivars resistant and susceptible to Fusarium oxysporum f. sp. cubense, identifying MaWRKY50 as a key gene in resistance.	The paper focuses on banana cultivars and the pathogen Fusarium oxysporum but does not mention Solanum lycopersicum or SlWRKY50 directly, making it only tangentially relevant to the query.	Musa spp. AAA	Musa spp. AAA	['Yueyoukang 1', 'Baxijiao']	not described	root	tissue-cultured plantlets	not described	seedling	not described	not described	Fusarium oxysporum f. sp. cubense inoculation	infection by Fusarium oxysporum f. sp. cubense	not described	not described	not described	collected after infection	RNA	total RNA	not described	not described	not described	Histological staining ; PCR ; digital gene expression analysis ; qRT-PCR	PrimeScriptTM RT Master Mix Kit; SYBR Premix Ex Taq Kit; Thermal Cycler Dice	next-generation sequencing; fluorescence detection	No	not specified	not described	not specified	3 biological replicates	3	3	not described	2	untreated control	not described	RNA integrity number > 8	mycoplasma screening negative	immune response	['gene expression levels']	Banana Fusarium wilt	log2FC > 1.5, p < 0.05	not described	t-test; ANOVA	not mentioned	Banana Fusarium wilt caused by Fusarium oxysporum f. sp. cubense (Foc) is one of the most destructive soil-borne diseases. In this study, young tissue-cultured plantlets of banana (Musa spp. AAA) cult...
40697707	PMC12280233	Transcriptome Analysis Reveals the Role of Trehalose in Response to Polyethylene Terephthalate Nanoplastics Treatment in Foxtail Millet (Setaria italica) Seedlings.	2025	Food science & nutrition	10.1002/fsn3.70593	8	Yes	The study investigates the gene expression changes in Setaria viridis seedlings exposed to nitrogen deficiency using RNA-Seq. It focuses on identifying differentially expressed genes and pathways involved in stress response.	This paper is relevant as it uses RNA-Seq to analyze gene expression under environmental stress, which aligns with the user's interest in studying gene expression changes due to environmental conditions.	Setaria viridis	Setaria viridis	not described	wild-type	seedling	not described	not described	seedling	not described	not described	nitrogen deficiency	nitrogen deficiency	25°C	16h light/8h dark, 70 μmol·m−2·s−1	not described	collected at noon	RNA	total RNA	not described	not described	not described	DESeq2 ; RNA-Seq ; Sequencing	Illumina HiSeq 2500	next-generation sequencing	Yes	2	every 7 days	14 days	3 biological replicates per time point	3	not described	completely randomized	2	untreated control	not described	RNA integrity number > 7.5	not mentioned	stress response	gene expression levels	not described	log2FC > 1, p < 0.05	DESeq2 normalization	t-test; ANOVA	Yes	Foxtail millet (Setaria italica), a drought-tolerant C4 model plant, faces increasing threats from polyethylene terephthalate (PET) nanoplastics in agricultural ecosystems. While prior studies indicat...
